[
  {
    "id": 1,
    "name": "Observar e Interagir",
    "description": "Um bom design depende de um relacionamento contínuo e recíproco com a paisagem e as pessoas, observando com cuidado antes de agir.",
    "guidingQuestion": "O que este lugar, essas pessoas ou este sistema já estão me mostrando, antes de eu propor qualquer mudança?",
    "colorToken": "green"
  },
  {
    "id": 2,
    "name": "Captar e Armazenar Energia",
    "description": "Desenvolvemos sistemas que coletam recursos quando estão abundantes, para usá-los quando forem necessários.",
    "guidingQuestion": "Quais fluxos de energia, água, nutrientes ou capital estão passando batido e poderiam ser captados?",
    "colorToken": "teal"
  },
  {
    "id": 3,
    "name": "Obter um Rendimento",
    "description": "Garanta que o projeto está gerando recompensas genuinamente úteis como parte do trabalho realizado.",
    "guidingQuestion": "Qual é o retorno real e tangível deste projeto para quem está envolvido?",
    "colorToken": "terra"
  },
  {
    "id": 4,
    "name": "Aplicar Autorregulação e Aceitar Feedback",
    "description": "Desencorajamos atividades inadequadas para garantir que os sistemas continuem funcionando bem ao longo do tempo.",
    "guidingQuestion": "Que mecanismos de avaliação e ajuste este design já prevê?",
    "colorToken": "dragon"
  },
  {
    "id": 5,
    "name": "Usar e Valorizar Recursos e Serviços Renováveis",
    "description": "Fazemos o melhor uso possível da abundância da natureza para reduzir o consumo e a dependência de recursos não renováveis.",
    "guidingQuestion": "O que a natureza já oferece de graça, que hoje estamos pagando para substituir?",
    "colorToken": "navy"
  },
  {
    "id": 6,
    "name": "Não Produzir Resíduos",
    "description": "Ao valorizar e fazer bom uso de todos os recursos disponíveis, nada é desperdiçado.",
    "guidingQuestion": "Para onde vão os \"resíduos\" deste sistema — e quem poderia se alimentar deles?",
    "colorToken": "olive"
  },
  {
    "id": 7,
    "name": "Design a Partir de Padrões para Detalhes",
    "description": "Ao dar um passo atrás, observamos padrões na natureza e na sociedade, usando-os para desenhar os detalhes.",
    "guidingQuestion": "Que padrão maior — climático, social, ecológico — este projeto precisa respeitar antes de entrar em detalhes?",
    "colorToken": "gold"
  },
  {
    "id": 8,
    "name": "Integrar ao Invés de Segregar",
    "description": "Ao colocar as coisas certas nos lugares certos, relações se desenvolvem e os elementos se apoiam mutuamente.",
    "guidingQuestion": "Quais elementos deste projeto poderiam trabalhar juntos, em vez de isolados?",
    "colorToken": "purple"
  },
  {
    "id": 9,
    "name": "Usar Soluções Pequenas e Lentas",
    "description": "Sistemas pequenos e lentos são mais fáceis de manter do que os grandes, e usam melhor os recursos locais.",
    "guidingQuestion": "Isto pode começar menor, mais devagar, e ainda assim ser bem-sucedido?",
    "colorToken": "slate"
  },
  {
    "id": 10,
    "name": "Usar e Valorizar a Diversidade",
    "description": "A diversidade reduz a vulnerabilidade a ameaças e explora a singularidade do ambiente em que o projeto está inserido.",
    "guidingQuestion": "Que monoculturas — de espécies, de pessoas, de ideias — este design pode evitar?",
    "colorToken": "forest2"
  },
  {
    "id": 11,
    "name": "Usar Bordas e Valorizar o Marginal",
    "description": "A interface entre coisas é onde os eventos mais interessantes acontecem — muitas vezes os elementos mais produtivos do sistema.",
    "guidingQuestion": "Onde estão as bordas deste projeto — e como podemos torná-las mais produtivas?",
    "colorToken": "sky"
  },
  {
    "id": 12,
    "name": "Usar e Responder à Mudança de Forma Criativa",
    "description": "Podemos ter um impacto positivo sobre mudanças inevitáveis, observando com cuidado e intervindo no momento certo.",
    "guidingQuestion": "Como este design permanece flexível diante do que ainda não sabemos?",
    "colorToken": "burgundy"
  }
]
